{
  "$schema": "https://open-design.ai/schemas/marketplace.v1.json",
  "specVersion": "1.0.0",
  "name": "open-docs-community",
  "version": "0.2.0",
  "owner": {
    "name": "MonoField Community",
    "url": "https://github.com/jhy0285/monofield"
  },
  "metadata": {
    "description": "Default MonoField community plugin registry seed. Entries remain restricted until the user installs and trusts them; upstream source, publisher, homepage, and license metadata are preserved per entry.",
    "version": "0.2.0"
  },
  "plugins": [
    {
      "name": "community/registry-starter",
      "title": "Community Registry Starter",
      "version": "0.1.0",
      "source": "github:nexu-io/open-design@main/plugins/community/registry-starter",
      "publisher": {
        "id": "open-design-community",
        "github": "nexu-io",
        "url": "https://github.com/nexu-io/open-design"
      },
      "homepage": "https://github.com/nexu-io/open-design/tree/main/plugins/community/registry-starter",
      "license": "MIT",
      "capabilitiesSummary": [
        "prompt:inject"
      ],
      "tags": [
        "community",
        "registry",
        "starter"
      ],
      "description": "A minimal community plugin that exercises the default registry source and install provenance path."
    },
    {
      "name": "community/import-smoke-test",
      "title": "Community Import Smoke Test",
      "version": "0.1.0",
      "source": "github:nexu-io/open-design@main/plugins/community/import-smoke-test",
      "publisher": {
        "id": "open-design-community",
        "github": "nexu-io",
        "url": "https://github.com/nexu-io/open-design"
      },
      "homepage": "https://github.com/nexu-io/open-design/tree/main/plugins/community/import-smoke-test",
      "license": "MIT",
      "capabilitiesSummary": [
        "prompt:inject"
      ],
      "tags": [
        "community",
        "import",
        "smoke-test",
        "marketplace"
      ],
      "description": "A portable community plugin used to verify folder, zip, GitHub subpath, and marketplace import flows."
    },
    {
      "name": "community/hallmark",
      "title": "Hallmark",
      "version": "1.0.0",
      "source": "github:nexu-io/open-design@main/plugins/community/hallmark",
      "publisher": {
        "id": "nutlope",
        "github": "Nutlope",
        "url": "https://github.com/Nutlope"
      },
      "homepage": "https://github.com/Nutlope/hallmark",
      "license": "MIT",
      "capabilitiesSummary": [
        "prompt:inject"
      ],
      "tags": [
        "community",
        "design",
        "frontend",
        "audit",
        "redesign",
        "anti-ai-slop"
      ],
      "description": "Anti-AI-slop design skill for greenfield pages, audits, redesigns, and design extraction from URLs or screenshots."
    }
  ]
}
